{
  "t": "state",
  "session_id": "2026-10-17T13-05-00_sahil_djin_vs_kaz",
  "frame": 412,
  "round": 1,
  "human_slot": 0,
  "players": [
    {
      "slot": 0,
      "character_id": 12,
      "character": "devil_jin",
      "health": 190,
      "recoverable_limit": 190,
      "max_health": 190,
      "x": 0.0,
      "y": 1003.5,
      "z": -1000.0,
      "facing": 0,
      "side": 0,
      "move_id": 32769,
      "frame_in_move": 12,
      "move_total": 100,
      "free_movement": true,
      "hit_level": "none",
      "hit_reaction": 0,
      "status": 6466,
      "basic_state": 3,
      "being_thrown": "none",
      "throw_escaped": false,
      "heat_gauge": 0.0,
      "heat_active": false,
      "heat_used": false,
      "rage_active": false,
      "power_crush": false,
      "first_active": 0,
      "last_active": 0,
      "first_airborne": 0,
      "last_airborne": 0,
      "dir_held": "n",
      "buttons_held": [],
      "buttons_pressed": []
    },
    {
      "slot": 1,
      "character_id": 8,
      "character": "kazuya",
      "health": 185,
      "recoverable_limit": 190,
      "max_health": 190,
      "x": 0.0,
      "y": 1003.5,
      "z": 1000.0,
      "facing": 0,
      "side": 1,
      "move_id": 32769,
      "frame_in_move": 12,
      "move_total": 100,
      "free_movement": true,
      "hit_level": "none",
      "hit_reaction": 0,
      "status": 6466,
      "basic_state": 3,
      "being_thrown": "none",
      "throw_escaped": false,
      "heat_gauge": 0.0,
      "heat_active": false,
      "heat_used": false,
      "rage_active": false,
      "power_crush": false,
      "first_active": 0,
      "last_active": 0,
      "first_airborne": 0,
      "last_airborne": 0,
      "dir_held": "n",
      "buttons_held": [],
      "buttons_pressed": []
    }
  ],
  "derived": {
    "distance_mm": 2000.0,
    "distance_bucket": "mid",
    "frame_advantage": null,
    "situation": "neutral",
    "bearing_deg": 0.0,
    "timer_s": 53.1
  }
}
